,Title,Abstract,Keywords,Conclusion,Authors,References
131,Study Of User Growth In Cellular Network Service Industry  On Lombok Island Indonesia,"lombok island is one of the islands which is prepared by the indonesian government to become a major tourist attraction after bali island. coupled with the existence of a new destination in mandalika, which has an international class circuit that is used for major international racing motogp and wsbk events. however, the basis of this research is the mobile network service users anomaly in lombok island. it was found that the number of users based on bps data for lombok island is still at an average of 63% of the total population of lombok island. this is a unique phenomenon, because the average user is far below of bali island which has reached at 94%, even the national average which is already at 91%. in this research, there are variables of price, network quality, service quality, and corporate image as independent variables which serve as a measure for user growth as dependent variable in lombok island. the objective of this research is to know how the preposition of independent and dependent variables are, and also to know how the effects of each variable relation are. this research used quantitative method with 100 respondents as users and operator representatives, fitting the limitation of operator employees number on unit level in lombok island. then from 100 respondents, divided based on the lombok island mobile network service operators market share. the research indicated a positive and significant effect to each of independent variables to user growth in lombok island mobile network service industry.","user growth, price, network quality, service quality",,"ananta pratama chrisna putra postgraduate student school of economics and business, telkom university bandung, indonesia anantapc@student.telkomuniversity.ac.id rina djunita pasaribu strategic management lecturer school of economy & business, telkom university bandung, indonesia rinadjunita@telkomuniversity.ac.id","References 
Amani, H., Alamanda, D. T., & Anggadwita, G., Identification of Customer Values in Telecommunication Service 
Industry: A Case of Postpaid Cellular Customers in Indonesia. 3rd International Conference on Information 
and Communication Technology (ICoICT), 2015. https://www.scopus.com/record/display.uri?eid=2-s2.0-
84960494751&origin=resultslist&sort=plf-f 
Badan Pusat Statistik.,Persentase Rumah Tangga yang Memiliki/Menguasai Telepon Seluler Menurut Provinsi dan 
Klasifikasi Daerah, 2021. 
Barich, H., & Kotler, P., A framework for marketing image management (1991st ed.). Pearson College Div., 1991. 
Belwal, R., & Amireh, M., Service Quality and Attitudinal Loyalty: Consumers’ Perception of Two Major 
Telecommunication Companies in Oman. Arab Economic and Business Journal, 2018. 
Cokins, G., Strategic Business Management: From Planning to Performance. Wiley, 2017. 
David, F. R. , Strategic Management: Concepts and Cases. Pearson Prentice Hall, 2007. 
David, F. R., Strategic management: Concepts and cases. Prentice Hall, 2011. 
Duncan, J., Mobile network society? Affordability and mobile phone usage in Grahamstown East. Communicatio: 
South African Journal for Communication Theory and Research, 2013. 
Frastika, F. D., Wijayantini, B., & Gunawan, Y., Analisis Structure Conduct Performance (SCP) pada Industri 
Peternak Telur Bebek di Desa Kencong. Fakultas Ekonomi Dan Bisnis Universitas Muhammadiyah Jember, 
2020. 
Greenspan, A. (2000). The Revolution in Information Technology. Conference on the New Economy., 2000 
Haro, A., Oktaviana, D., Dewi, A. T., Anisa, W., & Suangkupon, A., The Influence of Brand Image and Service 
Quality towards Purchase Intention and Its Impact on the Purchase Decision of Samsung Smartphone. 
International Conference on Economics, Business and Economic Education 2019, 2020. 
Johnson, G., Scholes, K., & Whittington, R.,  Exploring corporate strategy: Text and cases. Financial Times 
Prentice Hall, 2008. 
Kotler, P., & Armstrong, G.,  Principles of Marketing. Prentice Hall, 2012. 
Lubis, S. L., & Ashari, A. G.,  Faktor-Faktor Yang Mempengaruhi Tingkat Pertumbuhan Pelanggan terhadap 
Pelayanan Karyawan di Hotel Mega Permata Kota Padang Sidimpuan. Wahana Inovasi, 2016. 
Maicas, J. P., & Sese, F. J.,  Network Effects in the Mobile Communications Industry: An Overview. ResearchGate, 
2011. 
Maťová, H., Dzian, M., Triznová, M., Paluš, H., & Parobek, J., Corporate Image Profile. Procedia Economics and 
Finance, 2015. 
1217"
132,The Development Of Neural Network Based Rainfall-Runoff  Model For Kashmir Pakistan,"flooding disaster happens almost annually in pakistan. with no real solution to this incident, loss of human lives and wealth are inevitable. heavy rainfall is an important aspect which contributes to flooding. monitoring rainfall remains an integral part of flood defense system. one of the most leading method to predict flood is by developing a forecast model of rainfall-runoff. rainfall and river flow relation are very much subjective with various affecting factors. artificial neural network (ann) is preferred to model hydro system because of its accountability of nonlinear dynamics of water flow. a case study is done on a flood-prone river basin in jhelum river, in kashmir. rainfall data of 5 hydrologic stations and river level are used as the input. the performance of the learning algorithms involved were evaluated with a coefficient of determination (r) and mean square error (mse). the network configuration of the ann which best fit each algorithm is determined. the results achieved showed the promising advantage of lm as compared to br and pso.","rainfall, affect, flood, threat","The best configurations for each learning algorithms are attained. The configurations vary from one algorithm to another with no absolute number of neurons in hidden layer or delay (model order) which is dominant for all networks. This further proved the necessity of constructing a rainfall-runoff forecast model which is exclusive for a particular basin or river.12-hour forecast for rainfall-runoff prediction model in KASHMIR is developed. The results are satisfactory with prediction models producing low errors. The rainfall data and runoff data corresponds one another as the training generates good coefficient of correlation. Comparisons are made between ANNs with LM, BR and PSO as the learning algorithm. The algorithm which best suit to model Kashmir is determined. The performances of the networks are observed and the characteristics of each training algorithm, its advantages and disadvantages are analyzed and discussed. The main objective of this paper is to investigate, develop, and compare between rainfall-runoff models for the case study in Jehlum River, in Pakistan Kashmir. It could be concluded that the objective has been successfully achieved. ANNs model have been develop with three different learning algorithm applied on the simulations. The configuration which best suited each learning algorithm are determined for it to produce optimum prediction model. The performances of the networks are acquired, analyse and finally comparison are made. The best learning algorithm with custom network configuration is obtained. This presents the conclusion drawn from the study and recommendations made for further study. These are the recommendations which can further improve future studies on rainfall-runoff prediction model. Hydrological studies are wide in scope and there are many rooms for improvement. Below are some suggestions on which particular field of work that could be explored. A statistic study on how to estimate or interpolate incomplete information on rain intensity and river basin would be essential. There are gaps within the data given for rainfall and runoff. This may occurred because of rain gauge failure, measurement error or data acquisition deficiency. As missing values are discarded from the model, a portion of the data set is lost. Figure 18: MSE plot graph of training and testing data set against number of epoch for RF 3430097 and RF 3533102. 1228","madiha mazhar dept. of chemistry and chemical engineering lahore university of management sciences lahore , pakistan 14130007@lums.edu.pk","References 
Graff, P., Feroz, F., Hobson, M. P., & Lasenby, A., Neural Networks for Astronomical Data Analysis and Bayesian 
Inference. 2013 IEEE 13th International Conference on Data Mining Workshops, 16–23, 2013. 
Greenwood, A. J. B., Schoups, G., Campbell, E. P., & Lane, P. N. J., Bayesian scrutiny of simple rainfall – runoff 
models used in forest water management. JOURNAL OF HYDROLOGY, 512, 344–365, 2014. 
Nikam, V. B., & Meshram, B. B.,  Modeling Rainfall Prediction Using Data Mining Method: A Bayesian Approach. 
2013 Fifth International Conference on Computational Intelligence, Modelling and Simulation, 132–136, 
2013. 
Greenwood, A. J. B., Schoups, G., Campbell, E. P., & Lane, P. N. J.,  Bayesian scrutiny of simple rainfall – runoff 
models used in forest water management. JOURNAL OF HYDROLOGY, 512, 344–365, 2014. 
Liu, Y., Automatic calibration of a rainfall-runoff model using a fast and elitist multi-objective particle swarm 
algorithm. Expert Systems with Applications, 2009. 
Rashid, M. M., Romlay, M. R. M., & Ferdaus, M. M.,  Development of Electronic Rain Gauge System. International 
Journal of Electronics and Electrical Engineering, 3(4), 245–249, 2015. 
Shabir A., and Ullah M., “Heat transfer characteristics of CNT with chirality engineering for solar cell application,” 
In 2022 IEEE International Semiconductor Conference (CAS 2022), Barsov, Romania, 12-14. October 2022, 
pp. 159 -162. 
Shakil S.M. and M. S. Ullah. ""Effects of NBTI On PMOS Device With Technology Scaling."" 2022 IEEE 13th 
Annual Ubiquitous Computing, Electronics & Mobile Communication Conference (UEMCON 2022), NY, 
USA, 26 - 29 October 2022, pp. 0402 – 0406. 
Shabir A., and Ullah M., “Investigation of the emerging materials based high-efficiency cdte solar 
cell,” Proceedings of the 7th North American International Conference on Industrial Engineering and 
Operations Management (IEOM 2022), Orlando, USA, 11 -14 June 2022, pp. 2698-2706. 
Amin A.B., S. M. Shakil and M. S. Ullah, “A Theoretical Modeling of Adaptive Mixed CNT Bundles for High-
Speed VLSI Interconnect Design,” Crystals, vol. 12, no. 2, pp. 186-201, January 2022. 
Shabir A., and Ullah M., “Chirality Engineering on CNTs - A New Approach to Boost the Solar Cell 
Efficiency,” Proceedings of the 7th North American International Conference on Industrial Engineering and 
Operations Management (IEOM 2022), Orlando, USA, 11 -14 June 2022, pp. 1705-1706. 
Shabir, A., Cao, J., Fouad, E., & Ullah, M. W., “Prospects of solar cell technology from silicon to carbon nanotube,"" 
In 2022 IEEE 9th International Conference on Sciences of Electronics, Technologies of Information and 
Telecommunications (SETIT 2022), Genoa, Italy, 19 -21 March 2022, pp. 385-391. 
S. M. Shakil and M. H. Rashid, “ The Potential Impacts of Wireless Power Transfer on the Global Economy, 
Society, and Environment,”  in IEEE 14th Power Electronics, Drive Systems, and Technology Conference ( 
PEDSTC ) 31 january – 02 Feb. 2023. 
Shabir A., Zaidi B., Ullah M., (2023)“Carrier Generation Ability of CNTs to Harvest Maximum Energy from Solar 
Spectrum, “IEEE SoutheastCon 2023”, Orlando, USA, 14-16 April 2023, pp. 399-404. 
S M Shakil, Muhammad Sana Ullah, ""Analysis of HCD Effects for NMOS Transistor with Technology 
Scaling"", SoutheastCon 2023, pp.445-449, 2023. 
Shakil S M., and Ullah M. S., “Analyzing the Operational Parameters of a Single Walled Carbon Nanotube Field 
Effect Transistor (SWCNT-FET),” Proceedings of the 8th North American International Conference on 
Industrial Engineering and Operations Management (IEOM 2023), Houston, Texas, USA, 13 -15 June 2023. 
Shakil S M., and Ullah M. S., “Reliability Issues in Current MOSFET and Beyond Silicon Technology,” 
Proceedings of the 8th North American International Conference on Industrial Engineering and Operations 
Management (IEOM 2023), Houston, Texas, USA, 13 -15 June 2023. 
Shabir, A., & Ullah, M., “Explore the chirality engineering of carbon nanotubes for solar cell”. Florida 
Scientist, vol.85, no.2,pp. 68. 
Report: IEA-PVPS T13-02:2014, Characterization of performance of thin-film Photovoltaic Technologies, PVPS-
Photovoltaic Power Systems Programme, IEA-International Energy Agency, May 2014. 
Sites J. and Pan J., “Strategies to increase CdTe solar-cell voltage,” “Thin Solid Films”, vol. 515, no. 15, pp. 6099–
6102, 2007. 
1229"
133,Analysis Of Human Error In The Halal Supply Chain Of  Kemplang Crackers,"there is the potential for human error in the supply chain which can cause losses and affect the halal status of a product. halal products must be maintained from upstream to downstream and the chance of human error must be minimized. in the context of halal products in indonesia, there is a stipulation, criteria, and procedures for processing halal products from upstream to downstream that have been arranged in halal certification. however, there is a problem in the current system where no system can be 100% guaranteed because of the dependence on business actors. the purpose is to ensure the provisions in halal certification are carried out properly by business 1231",,"The conclusions obtained from the results of this study are: 1. The results of identifying human errors in the supply chain of kemplang crackers using the adoption of the SCOR model produce 26 types of errors, where in the plan process there are 3 types of errors, in the source process there are 4 types of errors, in make there are 16 types of errors, in deliver there are 2 error and on return there are 2 errors. 2. Based on the results of research using the SHERPA method, it is found that the highest probability of error with a critical level is found in the process of ordering raw materials, receiving raw materials, storing raw materials, washing fish, drying products, checking when drying so that they are not exposed to dirt, checking order notes and payment transactions. 3. Based on the results of research using the HEART method, the highest Human Error Probability (HEP) was obtained in the process of receiving raw materials from suppliers, storing raw materials, washing fish and checking when drying them so they are not exposed to dirt with a value of 5.03.","sari wahyuni undergraduate student at department of industrial engineering faculty of engineering university of sumatera utara medan, sumatera utara, indonesia sariwhyn.29@gmail.com mohammad azmi fadli undergraduate student at department of industrial engineering faculty of engineering university of sumatera utara medan, sumatera utara, indonesia azmiefadli@gmail.com novia maharani undergraduate student at department of industrial engineering faculty of engineering university of sumatera utara medan, sumatera utara, indonesia noviamaharani30@gmail.com putri amiroh lubis undergraduate student at department of industrial engineering faculty of engineering university of sumatera utara medan, sumatera utara, indonesia putriamirahlubis@gmail.com dini wahyuni department of industrial engineering faculty of engineering university of sumatera utara medan, sumatera utara, indonesia diniwahyuni2015@gmail.com",
134,A Review On Inspection Cost Minimization By Optimal  Number Inspectors In Apparel Manufacturing,"the apparel manufacturing organization is striving to minimize manufacturing costs, including inspection costs. the main goal of this paper is to reduce inspection costs by utilizing a minimum number of inspectors. in this paper, a mathematical model has been developed which will emphasize the determination of the inspection cost. the inspection cost is related to the standard minute value and the cost per minute. furthermore, this study has been focused on the resolution of the capacity and skill level of the inspectors. moreover, a linear program has been developed which can provide the number of inspectors required based on cost and the number of pieces needed to be inspected. the data has been collected from three types of factories: large, medium-sized and low-scale manufacturing units. it has been seen that at least 30%–35% of inspectors are higher than standard. the reason behind that is a lack of awareness and knowledge by the quality manager regarding inspection capacity, skill, and inspection target for the inspector. large scale companies take an additional 25% of inspectors to stay relaxed. medium-sized factories used 30% more inspectors to cover the inspection.","inspection cost, mathematical model, linear programming, cost minimization, inspection target",,"shibbir ahmad mechanical engineering department dhaka university of engineering & technology, gazipur, bangladesh ahmadjerin@gmail.com",
135,Design Of Mr Damper For Automobile Suspension With  Finite Element Method,"in this paper, a new energy generated semi-active suspension system based on magneto-rheological (mr) damper has been designed with the investigation of its power generation capability. the mathematical model for the suggested energy generated mr damper has developed and a 3d model of energy generated mr damper has developed in ems, where it is analyzed broadly by finite element method. the objectives of the simulation were to minimize the interaction issue between the damper and energy generator parts and confirm its power generation ability. the induced magnetic flux density, magnetic field intensity, applied current density, temperature gradient of this damper clearly validated this damper’s power generation.","mr damper, ems, energy generation","Advancement in MR damper technology is one of the challenging researches in the vibration control area. In this study a mono tube MR damper model is developed which has power generation competence. Here solid works EMS based finite element analysis is accomplished for characterizing and validating the model’s accuracy of power generation. In this damper model permanent magnets and coils are used as power generators that utilize wasted vibration energy from the environment. In this energy generated damper’s EMS analysis MR fluid gap width, outside air gap width, gap length, permanent magnet length, permanent magnet thickness, non-magnetic material thickness, piston head, coil housing thickness, diameter of the piston head, the number of coil turns, different materials used in overall model are selected as design parameters for model’s accuracy. From EMS electromagnetic analysis magnetic flux density, magnetic field intensity, temperature, the applied current density has been examined to characterize the power generation feature and all the results are clearly validating that quality. The magnetic isolation between the two separated fields has been observed clearly from those results. So, it can be concluded that the developed mono tube MR damper model works effectively as an energy generated device.","aamar shabir department of electrical and computer engineering florida polytechnic university lakeland, florida, usa ashabir0194@floridapoly.edu umar irshad, muhammad shoaib and huzaifa abeer department of electrical and computer engineering nfc institute of engineering and technology multan, pakistan umarirshad266@gmail.com, shoaibele120@gmail.com, theorientive1995@gmail.com",
136,Enhancing Disaster Management Through Effective  Warehouse Location Selection Using Linguistic Decision,"effective warehouse location selection is a critical component of disaster management, as it can significantly impact the efficiency and effectiveness of disaster response efforts. this paper proposes an integrated approach based on linguistic decision making (ldm) for assessing and prioritizing key criteria for warehouse location selection in disaster management. specifically, the 2-tuple linguistic (2-tl) model is used to represent decision-maker's subjective opinions, and then an integrated methodology combining 2-tl-dematel and 2-tl-topsis (technique for order preference by similarity to ideal solution) is employed for the analysis of the criteria and the selection of the optimal warehouse location. this approach allows decision-makers to effectively deal with subjective linguistic information and to handle uncertainty and imprecision in the decision-making process. the proposed methodology combines dematel for causal relation analysis and topsis for multi-criteria decision-making to identify and select the optimal warehouse location. moreover, the paper provides a case study conducted in the türkiye area to demonstrate the practical application of the proposed methodology. the results of the study provide an importance ranking of the key location selection criteria and reveal the causal relationships between them. the paper concludes that the proposed methodology can provide a structured and systematic approach for warehouse location selection in disaster management, and it can help decision-makers to improve the efficiency and effectiveness of disaster response efforts.",,,"making: an integrated approach gülçin büyüközkan professor, department of industrial engineering galatasaray university ortaköy, istanbul, turkey gbuyukozkan@gsu.edu.tr deniz uztürk department of management galatasaray university ortaköy, istanbul, turkey duzturk@gsu.edu.tr",
