,Title,Abstract,Keywords,Conclusion,Authors,References
92,Advancing Humanitarian Logistics Design Through  Linguistic Decision-Making Based Quality Function,"this paper proposes an innovative approach to designing effective humanitarian logistics systems based on linguistic decision-making. the authors aim to create a detailed roadmap for such systems by carefully considering the key needs that must be addressed. to accomplish this, they utilize the house of quality (hoq) method of quality function deployment (qfd), which establishes clear relationships between the various needs of humanitarian logistics and the specific requirements for designing effective systems. the inherently chaotic and complex nature of humanitarian logistics presents a significant challenge to effective design. however, the use of linguistic variables, combined with fuzzy logic-based techniques, can help to handle the vagueness and ambiguity of the field. the paper suggests using the 2-tuple linguistic (2-tl) model in combination with qfd technique to create more effective roadmaps that can be followed even in the face of uncertainty and unexpected events. this paper contributes to the existing literature by proposing a linguistic-based design approach to prioritize the design requirements for humanitarian logistics systems. this approach can guide practitioners to generate relevant strategies to address critical design requirements. the paper also presents a case study from türkiye to develop the proposed qfd models for humanitarian logistics design and provides further discussions and analysis at the end.","2-tuple linguistic, qfd",,"deployment gülçin büyüközkan professor, department of industrial engineering galatasaray university ortaköy, istanbul, turkey gbuyukozkan@gsu.edu.tr deniz uztürk department of management, business research center galatasaray university ortaköy, istanbul, turkey duzturk@gsu.edu.tr","references: 
A Sustainable Supply Chain Application, Applied Soft Computing, vol. 13, no. 9, pp. 3931–41, September 1, 
2013. DOI: 10.1016/j.asoc.2013.03.014 
Büyüközkan, G., Feyzioğlu, O. and Ruan, D., Fuzzy Group Decision-Making to Multiple Preference Formats in 
Quality Function Deployment, Computers in Industry, vol. 58, no. 5, pp. 392–402, June 1, 2007. DOI: 
10.1016/j.compind.2006.07.002 
Camargo Fiorini, P. de, Chiappetta Jabbour, C. J., Lopes de Sousa Jabbour, A. B. and Ramsden, G., The Human Side 
of Humanitarian Supply Chains: A Research Agenda and Systematization Framework, Annals of Operations 
Research, vol. 319, no. 1, pp. 911–36, December 2022. DOI: 10.1007/s10479-021-03970-z 
Chan, L.-K. and Wu, M.-L., Quality Function Deployment: A Literature Review, European Journal of Operational 
Research, vol. 143, no. 3, pp. 463–97, December 16, 2002. DOI: 10.1016/S0377-2217(02)00178-9 
Chanchaichujit, J., Pham, Q. C. and Tan, A., Sustainable Supply Chain Management: A Literature Review of Recent 
Mathematical Modelling Approaches, International Journal of Logistics Systems and Management, vol. 33, no. 
4, pp. 467–96, 2019. DOI: 10.1504/IJLSM.2019.101794 
European Commission, Humanitarian Logistics Policy, January 2022. 
Fuqua, D. and Hespeler, S., Commodity Demand Forecasting Using Modulated Rank Reduction for Humanitarian 
Logistics Planning[Formula Presented], Expert Systems with Applications, vol. 206, 2022. DOI: 
10.1016/j.eswa.2022.117753 
Gossler, T., Falagara Sigala, I., Wakolbinger, T. and Buber, R., Applying the Delphi Method to Determine Best 
Practices for Outsourcing Logistics in Disaster Relief, Journal of Humanitarian Logistics and Supply Chain 
Management, vol. 9, no. 3, pp. 438–74, 2019. DOI: 10.1108/JHLSCM-06-2018-0044 
Heaslip, G., Tatham, P. and Vaillancourt, A., Developing Individual Competencies for Humanitarian Logistics, in The 
Palgrave Handbook of Humanitarian Logistics and Supply Chain Management, Gyöngyi Kovács K. Spens and 
M. 
Moshtari, 
Eds., 
London: 
Palgrave 
Macmillan 
UK, 
accessed 
February 
17, 
2023, 
from 
http://link.springer.com/10.1057/978-1-137-59099-2_13, pp. 395–415, 2018. 
Herrera, F. and Martínez, L., A 2-Tuple Fuzzy Linguistic Representation Model for Computing with Words, IEEE 
Transactions on Fuzzy Systems, vol. 8, no. 6, pp. 746–52, 2000. 
Herrera, F. and Martinez, L., An Approach for Combining Linguistic and Numerical Information Based on the 2-
Tuple Fuzzy Linguistic Representation Model in Decision-Making, International Journal of Uncertainty, 
Fuzziness and Knowledge-Based Systems, vol. 8, no. 05, pp. 539–62, 2000. 
Holguín‐Veras, J., Jaller, M., Van Wassenhove, L. N., Pérez, N. and Wachtendorf, T., On the Unique Features of Post‐
disaster Humanitarian Logistics, Journal of Operations Management, vol. 30, no. 7–8, pp. 494–506, November 
2012. DOI: 10.1016/j.jom.2012.08.003 
Korkut, R. G., Çelik, M. and Özkaynak, S., A Critical Review of Quality Function Deployment (QFD) Tool Through 
Logistics Centre Development Projects, Lect. Notes Mech. Eng., Springer Science and Business Media 
Deutschland GmbH, accessed September 24, 2020, from https://www.scopus.com/inward/record.uri?eid=2-
s2.0-85096490050&doi=10.1007%2f978-3-030-62784-
3_37&partnerID=40&md5=59412828d886054d0b99a8e456910c20, pp. 441, 2021. 
Kovács, G. and Falagara Sigala, I., Lessons Learned from Humanitarian Logistics to Manage Supply Chain 
Disruptions, Journal of Supply Chain Management, vol. 57, no. 1, pp. 41–49, 2021. DOI: 10.1111/jscm.12253 
Kwapong Baffoe, B. O., and Luo, W., Humanitarian Relief Sustainability: A Framework of Humanitarian Logistics 
Digital Business Ecosystem, Transportation Research Procedia, vol. 48, pp. 363–87, 2020. 
Li, M., The Extension of Quality Function Deployment Based on 2-Tuple Linguistic Representation Model for Product 
Design under Multigranularity Linguistic Environment, Mathematical Problems in Engineering, p. 989284, 
2012. DOI: 10.1155/2012/989284 
Lukosch, H. and Comes, T., Gaming as a Research Method in Humanitarian Logistics, Journal of Humanitarian 
Logistics and Supply Chain Management, vol. 9, no. 3, pp. 352–70, 2019. DOI: 10.1108/JHLSCM-06-2018-
0046 
Martínez, L., Sensory Evaluation Based on Linguistic Decision Analysis, International Journal of Approximate 
Reasoning, vol. 44, no. 2, pp. 148–64, February 2007. DOI: 10.1016/j.ijar.2006.07.006 
Martínez, Luis, Rodriguez, R. M. and Herrera, F., The 2-Tuple Linguistic Model, Cham: Springer International 
Publishing, accessed May 4, 2018, from http://link.springer.com/10.1007/978-3-319-24714-4, 2015. 
850"
93,Embedding Social Determinants Of Health Into Ambulatory  Clinic Standard Work,"the ability of patients to successfully manage their own healthcare can have challenges outside the clinical realm. food insecurity can impact the physical and psychological state of an individual, and many patients feel the need to choose between paying for food and paying for medication. transportation to and from healthcare sites can be challenging, as delays or missed encounters for care contributing to negative clinical outcomes. these and other social determinants of health (sdoh) have a significant impact on the ability of a clinical best practice to achieve its desired outcome at the patient level. this poster strives to educate on how the university of texas medical branch is working to make the questions for sdoh a part of standard work to better identify and support those patients in need.","health, clinic, ambulatory",,"susan seidensticker and rebecca castro department of community and population health university of texas medical branch, usa smseiden@utmb.edu",
94,An Mcdm Approach To Smart Contract Adoption In Indian  Electronic Industry,"remember internet boom of 1990s and how its usage changed the way we look at world? blockchain technology (bt) is the internet of present time. studies highlighting ways to leverage the benefits of bt are being carried out aggressively and it's of keen interest for major industries and industrialists. every new research in the area indicate various benefits of bt related to performance improvements. therefore, to evaluate the enablers of blockchain adoption in smart contracts becomes essential and of great importance. for consumer driven economy like india, where implementation and adoption of bt has been sluggish, bt implementation can give strategic advantage to any industry, making it relevant to evaluate the feasibility and the importance of blockchain smart contracts in the electronic industry, which occupy a large share of the market. there are different enablers for bt adoption in different industries, and this study focuses on identifying and establishing the relationships between the enabler in the electronic supply chain. eight enablers were considered after conducting a survey of the literature before applying the interpretive structural modelling (ism) technique to understand the complex relationships between the identified enablers. the result of the detailed analysis, highlighted traceability as the most significant enabler among others for bt-related smart contract adoption for the electronic industry. this result is of immense importance for managers in identifying and developing policies and strategies related to bt implementation for the firm.","mcdm, smart contract","Supply chain contracts have been widely adopted by a large number of organisations and industry practitioners to deal with the complexities and uncertainties in the supply chain. The degree of flexibility and the required technologies to be adopted depends on a number of situations. This paper studies the enablers of blockchain to adopt smart contract for the short life cycle products. Eight enablers of blockchain that impacts smart contract adoption in the supply have been identified based on literature review and co-occurrence analysis of the corpus extracted from Scopus database. Various direct and indirect interrelationships between the enablers are identified using ISM and a hierarchical model is developed based on their driving and dependence powers. The MICMAC analysis is used along with ISM for classifying the enablers into four categories viz. autonomous, dependent, linkage and independent. A large number of enablers are positioned in the independent category as well as dependent category indicating that most of the enablers are not highly interlinked with each other. The results from the ISM can be used to identify which enablers to focus on to help in faster and smoother adoption of smart contract for the short life products. The research framework adopted in this study can be extended to other industries for future research. Different enablers can also be identified for analysing the feasibility and importance of smart contracts in the supply chains. Similar research can also be done using a combination of other MCDM techniques to support the findings of this study.","imnatila pongen and pritee ray department of operations management indian institute of management ranchi jharkhand-834008, india imnatila.pongen19ph@iimranchi.ac.in, pritee.r@iimranchi.ac.in",
95,Applications Of Federated Learning In Manufacturing:  Identifying The Challenges And Exploring The Future,"in manufacturing settings, data collection and analysis are often a time-consuming, challenging, and costly process. it also hinders the use of advanced machine learning and data-driven methods which require a substantial amount of offline training data to generate good results. it is particularly challenging for small manufacturers who do not share the resources of a large enterprise. recently, with the introduction of the internet of things (iot), data can be collected in an integrated manner across the factory in real-time, sent to the cloud for advanced analysis, and used to update the machine learning model sequentially. nevertheless, small manufacturers face two obstacles in reaping the benefits of iot: they may be unable to afford or generate enough data to operate a private cloud, and they may be hesitant to share their raw data with a public cloud. federated learning (fl) is an emerging concept of collaborative learning that can help small-scale industries address these issues and learn from each other without sacrificing their privacy. it can bring together diverse and geographically dispersed manufacturers under the same analytics umbrella to create a win-win situation. however, the widespread adoption of fl across multiple manufacturing organizations remains a significant challenge. this study aims to review the challenges and future directions of applying federated learning in the manufacturing industry, with a specific emphasis on the perspectives of industry 4.0 and 5.0.","federated learning, iot, industry 4.0, industry 5.0, cloud","With the growing availability of time-series data, the manufacturing industry is increasingly moving towards real- time and sequential learning through edge devices and the cloud (Raihan & Ahmed, 2019). However, small-scale manufacturers still do not possess the capability of collecting enough data by themselves or analyzing them in the cloud for a real-time decision. Although FL offers a potential solution to address this issue without compromising data privacy, its implementation remains rare in the manufacturing industry. In this study, we attempted to provide a discussion of FL and its potential applications across the diversified manufacturing industry. We also discussed the applications FL from the context of Industry 4.0 and Industry 5.0. Moreover, the challenges associated with adopting FL in the manufacturing industry are extensively reviewed and categorized in this work. Based on the analysis, it can be concluded that most of the challenges relate to technical readiness, including software and hardware. Therefore, the focus for future research should be on addressing these technical challenges, while simultaneously promoting a shift in organizational culture to prepare the industry for the adoption of FL and drive improved outcomes. Acknowledgments We would like to express our sincere gratitude to the Department of Industrial and Management Systems Engineering (IMSE) at West Virginia University (WVU) for their support in this research. Their resources, guidance, and expertise were invaluable in shaping the direction and scope of our study. We are also grateful for the encouragement and motivation provided by our professors and colleagues, which helped us to stay focused and committed throughout this project.","directions with industry 4.0 and 5.0 visions farzana islam, ahmed shoyeb raihan, imtiaz ahmed department of industrial and management systems engineering west virginia university morgantown, west virginia, usa fi00003@mix.wvu.edu, ar00065@mix.wvu.edu, imtiaz.ahmed@mail.wvu.edu",
96,Path Optimization Of Multi-Tool Drilling Using Genetic  Algorithm,"this paper presents an improved approach to minimize tool path length in multi-tool drilling operations using a genetic algorithm. hole drilling is prevalent in manufacturing processes, particularly in computer numerical control machines. holes often vary in size, necessitating tool switches during drilling. as the number of holes and tools increases, finding the optimal path becomes an np-hard problem. the proposed approach employs genetic algorithms to optimize the tool path for both multi-tool and single-tool drilling. a comparison of the proposed method with existing techniques reveals a reduction of up to 17% in total path length, highlighting the effectiveness of our approach.","path planning, optimization, genetic algorithm",,"mohamed b elnoor department of electrical and computer engineering university of maryland college park, md 20742, usa melnoor@umd.edu ebisa d wollega school of engineering colorado state university pueblo pueblo, co 81001, usa ebisa.wollega@csupueblo.edu","References  
Abdullah, H., Zakaria, M. S., Talib, N., Kiow, L. W., & Saleh, A., Optimization of Drilling Process Using Non-
Conventional Method. International Journal of Mechanical Engineering and Robotics Research, 9(9).2020 
Al-Sahib, N. K. A., & Abdulrazzaq, H. F., Tool path optimization of drilling sequence in CNC machine using genetic 
algorithm. Constraints (2a), 2, 2b. 2014. 
Dewil, R., Küçükoğlu, İ., Luteyn, C., & Cattrysse, D. A critical review of multi-hole drilling path optimization. 
Archives of Computational Methods in Engineering, 26, 449-459.2019. 
Dhouib, S., Zouari, A., Dhouib, S., & Chabchoub, H., Integrating the artificial bee colony metaheuristic with Dhouib-
Matrix-TSP1 heuristic for holes drilling problems. Journal of Industrial and Production Engineering, 40(3), 177-
187.2023. 
Karthikeyan, A., Karthikeyan, A., & Venkatesh Raja, K., Machine learning in optimization of multi-hole drilling 
using a hybrid combinatorial IGSA algorithm. Concurrent Engineering, 1063293X20908318. 2020. 
Karuppapan, R.; Saravanan, M.: Genetic Algorithm for TSP in Optimizing CNC Tool Path. Int. J. Engineering 
Technology,Management and Applied Sciences, 2017, 5 (2): 139-146, 2020. 
881"
97,Gender Sells: The Microeconomics Of  Gendered Advertising And Gender Contamination,"this review integrates semiotics, gender and feminist theory, and behavioral microeconomics in order to examine the impact of gendered advertising on consumer and brand behavior. i first examine how advertising, especially done through visual mediums, is produced by their social context and can be analyzed as cultural texts. i then explore how firms utilize gender norms and ideals in their advertising to build a brand image and establish a consumer base. as a part of this discussion, i investigate a specific kind of gendered advertising: sexual advertising, which commodifies the female and male bodies to intentionally illicit different consumer responses based on gender. referring to jill j. avery’s research in marketing, i scrutinize specific instances of gender contamination and the ways that consumers and businesses respond economically to defend stereotypical gender roles.","advertising, marketing, gender, sexual, contamination. 883",,"alina zhong stanford online high school redwood city, ca 94063, usa zhonga23@ohs.stanford.edu",
