,Title,Abstract,Keywords,Conclusion,Authors,References
66,5Th South American Conference On Industrial Engineering And Operations Management  Doi: 10.46254/Sa05.20240202,"this research aims to investigate the design and manufacturing of composite molds using ltc410 composite mold material with the objective to improve the mold manufacturing process in aerospace industry. the study will delve into designing the ltc410 composite mold system, product quality, costs, and manufacturing time by comparison with traditional mold. the research methodology comprises a fusion of theoretical analysis and practical experimentation of product b which is the prototype product of research. the research will commence by providing an overview of aluminum mold manufacturing methods, focusing on production costs and times. then study with the design of a composite mold system by ltc410 being a mold material and sp-165 pu board is the pattern of composite mold. the results of the research indicate that in the composite mold design process, mold scaling is unnecessary due to the minimal expansion exhibited by ltc410 mold material at the curing temperature of 135 degrees celsius. conversely, tool scaling is needed when design the pattern mold sp-165 by the calculated mold scale value necessitates a value of 0.9978 when applied to the 3d simulation program. additionally, composite molds demonstrate the potential to reduce mold manufacturing time by up to 44% and mold manufacturing costs by up to 46.6%, without compromising the company's production processes or the quality of the workpieces, as observed when compared with traditional mold.",mold scaling,"Base on the data provided, it is evident that composite molds can maintain equivalent production quality compared to traditional molds while offering significant advantages in terms of production time and cost efficiency. Specifically, the study reveals that composite molds exhibit a remarkable reduction in mold production time by 38.98% and a substantial cost saving of 44.24% when compared to traditional molds. These findings underscore the operational benefits and cost-effectiveness associated with adopting composite molds in manufacturing operations. Moreover, one notable advantage highlighted in the study is the reproducibility of composite molds. Unlike traditional molds, composite molds can be easily reproduced if the master plug remains in good condition. This capability eliminates the need to invest in new raw materials for each reproduction, further reducing production costs and enhancing resource utilization. The study highlights that for the same budget allocated to mold production, manufacturers have the potential to produce two composite molds in contrast to only one aluminum mold. This dual capacity for composite molds translates into increased production output, reduced waiting times, and enhanced manufacturing efficiency.","a study of ltc410 composite mold system to improve mold manufacturing process in aerospace industry phongchai jittamai and kanin rungrattanachavala school of industrial engineering institute of engineering suranaree university of technology nakhon ratchasima, 30000, thailand jittamai@sut.ac.th, m6302405@g.sut.ac.th",
67,5Th South American Conference On Industrial Engineering And Operations Management  Doi: 10.46254/Sa05.20240203,"sustainable supply chains are a crucial strategy adopted by companies to improve their environmental, social, and economic results in response to market demands. digital transformation introduces a new paradigm in the industry, reconfiguring manufacturing, products, services, and supply chains themselves. while sustainable supply chains and digital transformation in supply chains are gaining prominence, it is still unclear how digital transformation can effectively support sustainable supply chains. while the smart supply chain (ssc) approach aims to improve productivity, quality, and flexibility, sustainable supply chains seek to establish trust and transparency in their sustainable processes by integrating environmental responsibility in a competitive way. the purpose of this thesis is to explore how digital transformation can effectively strengthen sustainable supply chains. to achieve this objective, the thesis combines quantitative and qualitative methods. the research involved a survey of 473 manufacturing companies to elucidate how ssc can contribute to sustainability in supply chains, in terms of both environmental and financial results. to complement this focus, a qualitative research study was conducted through a multiple case study approach, which focused on leading companies in the manufacturing sector that have implemented sustainable practices. the thesis results indicate that the ssc approach effectively promotes the development of sustainable supply chains, enabling the intelligent and sustainable creation of long-term value. it promotes the adoption of sustainable practices in supply chains to reduce carbon footprints and create carbon-neutral networks. additionally, it aims to develop partnerships between different actors in the chain to reduce inequalities and promote economic growth.",smart supply chain,,"smart sustainable supply chain management: how smart supply chain enables the sustainable development of supply chains laura visintainer lerman industrial engineering department engineering school federal university of rio grande do sul porto alegre, brazil laura.lerman@ufrgs.br, lauravlerman@gmail.com",
68,5Th South American Conference On Industrial Engineering And Operations Management  Doi: 10.46254/Sa05.20240206,"nowadays, ergonomics is implementing new methodologies across various sectors, including workplaces, production facilities, and common areas, in order to maximize productivity. this research focuses on conducting an ergonomic analysis using rula and reba techniques in a bakery business to reduce the development of musculoskeletal disorders. after conducting a systematic literature review to understand the evolution of ergonomics in organizational settings, the analysis was performed using ergonautas website, where data were recorded to assess the risk levels of activities. a diagnosis of the company was carried out, focusing on the workstations that are part of the production process, in which several opportunities for improvement were found. through the nordic questionnaire, it was possible to identify the main discomforts of the operators, which are hands (100%), followed by the elbow (85.71%), and lastly, the shoulders (71.43%). the production activities posing ergonomic risks are mixing, cutting, and baking. this was identified using the reba and rula techniques, which indicate that mixing represents a high risk, followed by cutting, which has a medium risk, as well as baking. in the case of mixing, it is recommended to intervene at the station as soon as possible.","bakery industry, ergonomics, rula, reba","Through posture diagnosis using REBA and RULA, it was determined that the postures adopted by operators during the production process are harmful. The bending angle of the operators is inadequate for the type of work performed (mixing, cutting, and baking). Production activities posing an ergonomic risk are mixing, cutting, and baking. This was identified using the REBA and RULA techniques, which indicate that mixing poses a high risk, followed by cutting with a medium risk, similar to baking. In the case of mixing, it is recommended to intervene at the station as soon as possible. Anthropometric data of the operators were obtained, allowing for a proposal for improvement considering the results of REBA and RULA. Thus, if the improvement proposal is implemented, it could prevent the development of musculoskeletal disorders as each station adapts to the anthropometric measurements of the operators. Through the Nordic questionnaire, the main ailments of operators during the production process were identified, which are hands (100%), followed by the elbow (85.71%), and lastly the shoulders (71.43%). Among the limitations for future research are the time and cost of implementing ergonomic designs in the machines, since specialized labor is required to guarantee correct installation. Also, data collection during the production process can affect worker performance. Research could be conducted on the effectiveness of worker ergonomics training to improve work practices, increase productivity, and reduce the cost of personal injury. The application of REBA, RULA, and the Nordic questionnaire allowed us to recognize the discomfort of the operators and, consequently, identify activities with a higher ergonomic risk. These techniques can be applied in SMEs from different sectors in order to counteract discomfort and improve the ergonomic conditions of the activities they present.","ergonomic model to reduce the development of musculoskeletal disorders in the process of production of empanadas in a sme mariel pinche ruiz engineering school university of lima, peru 20181466@aloe.ulima.edu.pe rodrigo alonso ventura paredes engineering school university of lima, peru 20183411@aloe.ulima.edu.pe wilfredo r. hernandez gorritti engineering school university of lima, peru rhernand@ulima.edu.pe",
69,5Th South American Conference On Industrial Engineering And Operations Management  Doi: 10.46254/Sa05.20240207,"in a vuca environment, marked by volatility, uncertainty, complexity, and ambiguity, developing a resilient manufacturing strategy (ms) is fundamental for adapting and transforming adversities into opportunities, ensuring long-term competitiveness and sustainability. this study identifies key strategies and enablers for developing a resilient ms. this study employed a systematic five-stage literature review, using scopus and wos for data collection and vosviewer® and atlas.ti® for bibliometric and content analysis, respectively. conducted in march 2024, the process narrowed down from 1,144 articles to 232 for in-depth examination, focusing on identifying research opportunities. post-2020, there has been a significant increase in the academic focus on manufacturing strategy (ms) and its resilience, identifying critical research areas such as the development of resilient theoretical frameworks and the enhancement of strategic resilience in manufacturing. this analysis underscores the importance of agility and proactiveness in manufacturing systems, emphasising the necessity of incorporating uncertainty into strategic decision-making. furthermore, the pivotal role of technological innovation, particularly through the adoption of industry 4.0 technologies, in strengthening organisational resilience is highlighted. findings were categorised into resilience approaches, components thereof, and ms-specific resilience, offering a structured and in-depth view of the field and promoting an interdisciplinary approach that integrates strategic management, advanced technology, and the analysis of cultural and organisational dynamics. this comprehensive view is essential for designing resilient manufacturing systems in the face of global volatility, setting a research precedent for future explorations in resilient and adaptive manufacturing practices.","resilience, ms enablers",,"forging resilience in manufacturing strategy: an interdisciplinary approach in a vuca world cristian rincón guio industrial engineering department engineering faculty corporación universitaria minuto de dios - uniminuto bogotá, colombia cristian.rincon.g@uniminuto.edu, rinconguio@gmail.com",
70,5Th South American Conference On Industrial Engineering And Operations Management  Doi: 10.46254/Sa05.20240208,"the study highlights a theoretical problem concerning the need for more emphasis on sustainability in smart supply chain research, primarily due to challenges in integrating the two domains. smart supply chain prioritizes productivity, quality, and flexibility, while sustainability focuses on sustainable development encompassing economic, social, and environmental aspects. recognizing this discrepancy, the study aimed to identify prevalent concepts at the intersection of sustainability and smart supply chain. to achieve this objective, the researchers employed latent dirichlet allocation (lda) and lda mallet to analyze recently published articles in this area. the lda mallet results revealed distinct research directions that can be pursued. these research lines offer valuable insights for academic exploration and practical implementation in the supply chains. they can inform the development of new projects and serve as a foundation for frameworks and roadmaps promoting sustainable digital development, technological innovation, and sustainability within smart supply chains.",smart supply chain,,"sustainability in the context of the smart supply chain: a natural language processing approach laura visintainer lerman industrial engineering department engineering school federal university of rio grande do sul porto alegre, brazil laura.lerman@ufrgs.br, lauravlerman@gmail.com daisy valle enrique industrial engineering department engineering school universidade beira interior covilhã, portugal wagner henz schettert senior software architect sap são leopoldo, brazil","References  
Aliahmadi, A., Nozari, H., & Ghahremani-Nahr, J. AIoT-based sustainable smart supply chain framework. 
International journal of innovation in management, economics and social sciences, 2(2), 28–38. 2022; 
Benitez, G. B., Lima, M. J. do R. F., Lerman, L. V., & Frank, A. G. Understanding Industry 4.0: Definitions and 
insights from a cognitive map analysis. Brazilian Journal of Operations & Production Management, 16(2), 
Artigo 2. https://doi.org/10.14488/BJOPM.2019.v16.n2.a3. 2019 
Berman, B. 3-D printing: The new industrial revolution. Business Horizons, 55(2), 155–162. 
https://doi.org/10.1016/j.bushor.2011.11.003. 2012 
Berttram, P., & Schrauf, S. How digitization makes the supply chain more efficient, agile, and customer-focused. 
2016 
Boussaadi, S., Aliane, H., Cerist, A., & Abdeldjalil, P. O. Modeling of scientists profiles based on LDA. Academic 
Press. https://www.academia.edu/download/63964026/Boussaadi_paper20200719-5515-17vchi5.pdf. 2020. 
Cimini, C., Lagorio, A., Romero, D., Cavalieri, S., & Stahre, J. Smart logistics and the logistics operator 4.0. IFAC-
PapersOnLine, 53(2), 10615–10620. 2020.  
Dallasega, P., Woschank, M., Zsifkovits, H., Tippayawong, K., & Brown, C. A.. Requirement analysis for the 
design of smart logistics in SMEs. Industry 4.0 for SMEs: Challenges, opportunities and requirements, 147–
162. 2020. 
Dzhuguryan, T., & Deja, A. Sustainable waste management for a city multifloor manufacturing cluster: A 
framework for designing a smart supply chain. Sustainability, 13(3), 1540. 2021. 
Enrique, D. V., Lerman, L. V., Sousa, P. R. de, Benitez, G. B., Bigares Charrua Santos, F. M., & Frank, A. G. Being 
digital and flexible to navigate the storm: How digital transformation enhances supply chain flexibility in 
turbulent environments. International Journal of Production Economics, 250, 108668. 
https://doi.org/10.1016/j.ijpe.2022.108668. 2022.  
Frank, A. G., Dalenogare, L. S., & Ayala, N. F. Industry 4.0 technologies: Implementation patterns in manufacturing 
companies. International Journal of Production Economics, 210, 15–26.2019.  
Frederico, G. F., Garza-Reyes, J. A., Anosike, A., & Kumar, V. Supply Chain 4.0: Concepts, maturity and research 
agenda. Supply Chain Management: An International Journal, 25(2), 262–282. 2019. 
Groschopf, W., Dobrovnik, M., & Herneth, C.. Smart contracts for sustainable supply chain management: 
Conceptual frameworks for supply chain maturity evaluation and smart contract sustainability assessment. 
Frontiers in Blockchain, 4, 506436. 2021.  
Kipper, L. M., Furstenau, L. B., Hoppe, D., Frozza, R., & Iepsen, S. Scopus scientific mapping production in 
industry 4.0 (2011–2018): A bibliometric analysis. International Journal of Production Research, 58(6), 1605–
1627. https://doi.org/10.1080/00207543.2019.1671625. 2020. 
Kurfess, T. R., Saldana, C., Saleeby, K., & Dezfouli, M. P. A Review of Modern Communication Technologies for 
Digital Manufacturing Processes in Industry 4.0. Journal of Manufacturing Science and Engineering, 
142(110815). https://doi.org/10.1115/1.4048206. 2020. 
724"
71,5Th South American Conference On Industrial Engineering And Operations Management  Doi: 10.46254/Sa05.20240210,"the objective of this research is to use the ""lean manufacturing"" methodology to increase productivity in the production area of a company in the bakery sector. for the analysis, one shift (morning shift) of the two daily production shifts was considered. the problem in the bakery is the lack of follow-up in each process performed by the baker. this results in a greater use of resources, generating higher costs for the company. it also limits the response to higher production demands. the current productivity of the company is 63.56%. the vsm was used to analyze the current state of the bakery, the different variables and main factors involved in bread production. of the different tools of the lean manufacturing methodology, the smed tool was chosen because it is one of the best working tools that help reduce the changeover time and configuration of a product or batch. in this case, will be applied to reduce the time of any process by more than 30%. the time of each process was calculated with the use of a stopwatch. after applying the methodology, a new vsm and a production design model were designed, resulting in a productivity increase of 80.23%.","bakery, lean manufacturing, productivity","The null hypothesis is not rejected and the duration time to verify kneading conforms to a Beta distribution. 1.38 + 0.24 * BETA (1.55, 1.75) 6. Conclusion After the application of the SMED tool in the following work, the following conclusions were obtained: It is feasible to use Lean Manufacturing methodology to improve bakery productivity. It is demonstrated that the use of the SMED tool reduces the processing time per shift by 98.53 minutes, making it an acceptable practice for reducing food productions times. As a consequence, labour and electricity costs are reduced. Through the application of the SMED tool, an increase in the man-hour unit of the work performed by the operator on bread production is evidenced. It is possible to make an additional car of bread as long as there is an additional consumption public to the one that exists the bakery. It is essential to have protective equipment throughout the production of bread, because there are processes in which without the use of these it is not possible to perform them. Another contribution was to be able to provide flexibility to adapt to changes in demand, respecting the time limits. In this way it will be possible to obtain an immediate response to any new situation. The impact of the following scientific article will be of help to many small and medium sized companies in the bakery sector to improve their bread production processes because the research is focused on this target audience that do not have the necessary resources to acquire more modern machines and have limited budgets for personnel. From the following research, the use of the baker's man-hour and machine-hour estimation unit of the machines will be optimized, thus decreasing the bread production time, labor and electricity costs. In addition, this model will be able to meet variations in customer demand without affecting the productivity of the bakery. To take advantage of the work presented, it is important to collect the exact time taken by each baker in a bread production shift and validate it through automation and event simulation software. In this way, the application of any Lean Manufacturing tool will have more accurate results, for the desired improvements. It is important to always receive feedback from the customer to know their experience in the service provided if it meets the expectations and thus identify areas for improvement and process readjustments.","implementation of lean manufacturing smed and value stream mapping tools to increase productivity in a bakery company jimmy andré cárdenas peña and jhoel oswaldo veliz veliz universidad de lima industrial engineering lima, peru 20130235@aloe.ulima.edu.pe ; 20174022@aloe.ulima.edu.pe",
