,Title,Abstract,Keywords,Conclusion,Authors,References
55,Supply Chain Agility And Organization Performance:  A Resource Based View,"in today's fast-paced and ever-changing business world, supply chain agility (sca) is essential for survival. the primary purpose of this study is to better understand the current state of sca research in order to better clarify the area and summarize prospective future research routes. to gain an understanding of the elements that contribute to supply chain agility and how sc agility affects business outcomes. the resource based view (rbv) takes what could be called an ""inside-out"" viewpoint, or one that is specific to a certain business when assessing the variables that have led to its success or failure in the marketplace. acquiring valuable, uncommon, original, and non-replicable resources and then applying these resources and advantages to generate extraordinary results is how organizations gain and keep a comparative advantage over their competitors. this investigation put the predicted connection to the quantitative test. in particular, responses to anonymous online surveys were collected. there were 13 hypothesis put up and investigated in this study, four were found to rejected which were all mediation analysis.",,,"syed imran zaman school of economics and management southwest jiaotong university, chengdu, china and department of business administration jinnah university for women, karachi, pakistan s.imranzaman@gmail.com sharfuddin ahmed khan industrial systems engineering university of regina, regina, canada sharfuddin.khan@uregina.ca sherbaz khan department of supply chain and logistics institute of business management, karachi, pakistan analyzeus@gmail.com","References  
ACEDO, F. J., BARROSO, C. & GALAN, J. L. The resource‐based theory: dissemination and leading trends. 
Strategic management journal, 27, 621-636. 2006. 
AHMED, W., NAJMI, A., MUSTAFA, Y. & KHAN, A. Developing model to analyze factors affecting firms’ agility 
and competitive capability: A case of a volatile market. Journal of Modelling in Management. 2019. 
AL-ANSARI, Y., ALTALIB, M. & SARDOH, M. Technology orientation, innovation and business performance: A 
study of Dubai SMEs. The International Technology Management Review, 3, 1-11. 2013. 
AL-HENZAB, J., TARHINI, A. & OBEIDAT, B. Y. The associations among market orientation, technology 
orientation, entrepreneurial orientation, and organizational performance. Benchmarking: An International 
Journal. 2018. 
ALERASOUL, S. A., AFELTRA, G., HAKALA, H., MINELLI, E. & STROZZI, F. Organizational learning, learning 
organization, and orientation: An integrative review and framework. Human Resource Management Review, 
100854. 2021. 
SARASWATI, A. Supply chain management, Supply chain mapping, and business performance. Journal of Global 
Strategic Management, 9, 134-145. 2011. 
ASLAM, H., KHAN, A. Q., RASHID, K. & REHMAN, S.-U. Achieving supply chain resilience: the role of supply 
chain ambidexterity and supply chain agility. Journal of Manufacturing Technology Management, 31, 1185-
1204. 2020. 
BAMEL, U. K. & BAMEL, N. Organizational resources, KM process capability and strategic flexibility: a dynamic 
resource-capability perspective. Journal of Knowledge Management. 2018. 
BARNEY, J. B., KETCHEN JR, D. J. & WRIGHT, M. The future of resource-based theory: revitalization or decline? 
Journal of Management, 37, 1299-1315. 2011. 
CALANTONE, R. J., CAVUSGIL, S. T. & ZHAO, Y. I am learning orientation, strong innovation capability, and 
firm performance. Industrial marketing management, 31, 515-524. 2002. 
CEGARRA-NAVARRO, J.-G., SOTO-ACOSTA, P. & WENSLEY, A. K. Structured knowledge processes and firm 
performance: The role of organizational agility. Journal of Business Research, 69, 1544-1549. 2016. 
CHAN, A. T., NGAI, E. W. & MOON, K. K. The effects of strategic and manufacturing flexibilities and supply chain 
agility on firm performance in the fashion industry. European Journal of Operational Research, 259, 486-499. 
2017. 
CHEN, Y., WANG, Y., NEVO, S., BENITEZ, J. & KOU, G. Improving strategic flexibility with information 
technologies: insights for firm performance in an emerging economy. Journal of Information Technology, 32, 
10-25. 2017. 
CHIN, W. W. How to write up and report PLS analyses. Handbook of partial least squares. Springer. 2010. 
CORTEZ, R. M. & JOHNSTON, W. J. The Coronavirus crisis in B2B settings: Crisis uniqueness and managerial 
implications based on social exchange theory. Industrial Marketing Management, 88, 125-135. 2020. 
DEGROOTE, S. E. & MARX, T. G. The impact of IT on supply chain agility and firm performance: An empirical 
investigation. International Journal of Information Management, 33, 909-916. 2013. 
DUBEY, R., ALTAY, N., GUNASEKARAN, A., BLOME, C., PAPADOPOULOS, T. & CHILDE, S. J. Supply chain 
agility, adaptability, and alignment: empirical evidence from the Indian auto components industry. 
International Journal of Operations & Production Management. 2018. 
DUBEY, R., GUNASEKARAN, A., CHILDE, S. J., PAPADOPOULOS, T., BLOME, C. & LUO, Z. Antecedents of 
resilient supply chains: An empirical study. IEEE Transactions on Engineering Management, 66, 8-19. 2017. 
ESMAEILIKIA, M., FAHIMNIA, B., SARKIS, J., GOVINDAN, K., KUMAR, A. & MO, J. Tactical supply chain 
planning models with inherent flexibility: definition and review. Annals of Operations Research, 244, 407-
427. 2016. 
FAYEZI, S., ZUTSHI, A. & O'LOUGHLIN, A. Understanding and developing supply chain agility and flexibility: a 
structured literature review. International journal of management reviews, 19, 379-407. 2017. 
GADERMANN, A. M., GUHN, M. & ZUMBO, B. D. Estimating ordinal reliability for Likert-type and ordinal item 
response data: A conceptual, empirical, and practical guide. Practical Assessment, Research, and Evaluation, 
17, 3. 2012. 
480"
56,Role Of Green Supply Chain Practices In Improving Firm'S  Sustainability And Performance,"this paper aimed to investigate the impact of organizational pressure and environmental consciousness on businesses' adoption of green supply chain practices (gscps). gsc management (gscm) should be incorporated into an organization's strategic approach to achieve significant performance enhancement. the target companies for this project were pakistan's leading textile, garment, and apparel manufacturers and exporters. the influence of variables such as knowledge management orientation (kmo), strategic orientation (so), market orientation (mo), and green entrepreneurial orientation (geo) was investigated. a comprehensive and inclusive survey instrument based on the likert scale was used to collect data. 261 employees from 261 textile companies participated. the data were analyzed, and hypotheses were tested using the structural equational model (sem) method and the smart pls software, which permitted the development and testing of a complex and interactive conceptual framework. the results will be beneficial for business managers and policymakers. this study demonstrates that institutional pressure has a more significant impact than environmental awareness in encouraging businesses to implement sustainable supply chain strategies. the economy's recovery would be significantly dependent on the effectiveness of the governing bodies. in addition to dynamic capabilities and strategy renewal funded by government capital assistance, critical and sustaining factors for sme performance include dynamic capabilities. the research also revealed that the conventional pressure exerted by distribution network partners and consumers had the most significant impact among the various business pressures, followed by simulated pressure.",,,"sherbaz khan department of supply chain and logistics institute of business management, karachi, sindh 75190, pakistan analyzeus@gmail.com m. affan badar bailey college of engineering and technology indiana state university, terre haute, in 47809, usa m.affan.badar@indstate.edu sharfuddin ahmed khan industrial systems engineering university of regina, regina, sk s4s 0a2, canada sharfuddin.khan@uregina.ca syed imran zaman department of business administration jinnah university for women, karachi, sindh 74600, pakistan s.imranzaman@gmail.com","References  
Agarwal, S., Erramilli, M.K. and Dev, C.S., Market orientation and performance in service firms: Role of innovation, 
Journal of Services Marketing, vol. 17, pp. 68–82, 2003.  
Ahmed, S.S., Akter, T. and Ma, Y., Green supply chain management (GSCM) performance implemented by the textile 
industry of Gazipur district, Dhaka, Logistics, vol. 2, no.4, 21, 2018. 
Al-Odeh, M., Smallwood, J. and Badar, M.A., A framework for implementing sustainable supply chain management, 
International Journal of Advanced Operations Management, vol. 13, no. 3, pp. 212-233, 2021. 
Attia, A. and Salama, I., Knowledge management capability and supply chain management practices in the Saudi food 
industry, Business Process Management Journal, vol. 24, no. 2, pp. 459-477, 2018. 
Attia, A. and Essam Eldin, I., Organizational learning, knowledge management capability and supply chain 
management practices in the Saudi food industry, Journal of Knowledge. Management, vol. 22, no. 6, pp. 1217–
1242, 2018. 
Barney, J., Firm resources and sustained competitive advantage, Journal of Management, vol. 17, pp. 99–120, 1991.  
BOI, Invest Pakistan: Textile, Available: https://invest.gov.pk/textile, Accessed on Mar 25, 2023. 
Bolisani, E. and Bratianu, C., Knowledge strategy planning: An integrated approach to manage uncertainty, 
turbulence, and dynamics, Journal of Knowledge Management, vol. 21, pp. 233–253, 2017.  
Badar, M.A., Sammidi, S. and Gardner, L., Reducing the bullwhip effect in the supply chain: A study of different 
ordering strategies, The Journal of Technology Studies, vol. 39, no. 1, pp. 52-63, 2013. 
Bowen, F., Cousins, P., Lamming, R. and Faruk, A., Horses for courses: Explaining the gap between the theory and 
practice of green supply, In: Greening the Supply Chain, pp. 151-172, Springer, London, 2006. 
Choi, D., Market orientation and green supply chain management implementation, International Journal of Advanced 
Logistics, vol. 3, no. 1-2, pp. 1–9, 2014. 
El-Garaihy, W.H., Badawi, U.A., Seddik, W.A.S. and Torky, M.Sh., Investigating performance outcomes under 
institutional pressures and environmental orientation motivated green supply chain management practices, 
Sustainability, vol. 14, no. 3, p. 1523, 2022. 
Eltayeb, T.K., Zailani, S. and Ramayah, T., Green supply chain initiatives among certified companies in Malaysia and 
environmental Sustainability: Investigating the outcomes, Resources, Conservation and Recycling, vol. 55, no. 5, 
pp. 95–506, 2011.  
Faisal, A., Hermawan, A. and Arafah, W., The Influence of strategic orientation on firm performance mediated by 
social media orientation at MSMEs, International Journal of Science and Engineering Invention, vol. 4, no. 8, 
pp. 22–31, 2018.  
Frambach, R.T., Prabhu, J. and Verhallen, T.M.M., The influence of business strategy on new product activity: The 
role of market orientation, International Journal of Research in Marketing, vol. 20, no. 3, pp. 377–397, 2003. 
Gast, J., Gundolf, K. and Cesinger, B., Doing business in a green way: A systematic review of the ecological 
sustainability entrepreneurship literature and future research directions, Journal of Cleaner Production, vol. 147, 
pp. 44–56, 2017.  
Gholami, H., Abu, F., Sharif, S., Abdul-Nour, G. and Badar, M.A., A review of global research trends on sustainable 
manufacturing, In: Sustainable Manufacturing in Industry 4.0: Pathways and Practices, pp. 1- 17, Springer, 
Singapore, 2023. 
Green, K.W., Toms, L.C. and Clark, J.H., Impact of market orientation on environmental sustainability strategy, 
Management Research Review, vol. 38, pp. 217–238, 2015.  
Habib, M.A., Bao, Y. and Ilmudeen, A., The impact of green entrepreneurial orientation, market orientation and green 
supply chain management practices on sustainable firm performance, Cogent Business & Management, vol. 7, 
no. 1, article 1743616, 2020.  
Hair, J.F., Hult, G.T.M., Ringle, C. and Sarstedt, M., A Primer on Partial Least Squares Structural Equation Modeling 
(PLS-SEM), 2nd edn, SAGE Publications, Thousand Oaks, CA, USA, 2016. 
Huang, J.-W. and Y.-H. Li, Y.-H., Green innovation and performance: The view of organizational capability and 
social reciprocity, Journal of Business Ethics, vol. 145, no. 2, pp. 309-324, 2017. 
Hughes, P., Hodgkinson, I.R., Hughes, M. and Arshad, D., Explaining the entrepreneurial orientation - Performance 
relationship in emerging economies: The intermediate roles of absorptive capacity and improvisation, Asia Pacific 
Journal of Management, vol. 35, no. 4, pp. 1025–1053, 2018.  
Hult, G.T.M., Hair, J.F., Proksch, D., Sarstedt, M., Pinkwart, A. and Ringle, C. M., Addressing endogeneity in 
international marketing applications of partial least squares structural equation modeling, Journal of International 
Marketing, vol. 26, no. 3, pp. 1-21, 2018. 
493"
57,Strategic Analysis Of Digital Technologies In The Healthcare  Sector Through The Application Of Multiple Preference,"digital technologies are including many different technologies that enable information to be collected, stored, and easily accessed when needed. the use of digital technologies is also increasing in the health sector, where service processes are intense and complex. strategic considerations would be appropriate to analyze the use of these technologies. for this reason, in this study, a strategic evaluation was made on digital technologies in the health sector. with the swot analysis, the current situation analysis regarding digital technologies in the health sector was made. then, the weights of swot factors were determined with the multiple preference relations (mpr) integrated dematel method. subsequently, alternative strategies were determined and prioritized with mpr integrated topsis method. the mpr technique is aimed to analyze the uncertainties and reach more accurate and reliable results by gathering the evaluations of experts in different formats or incomplete opinions under a single group decision. the proposed methodology integrated with swot analysis on digital technologies in the health sector constitutes the originality of the study. in line with the results obtained from this study, both researchers and managers will be able to create and use more effective digital technology strategies for the health sector.","swot analysis, dematel, topsis, healthcare","Today, the use of innovative technologies is seen as an important determinant in increasing the quality of health services and patient safety. Along with the strengths that the use of these technologies will bring, their weaknesses and opportunities/threats should also be analyzed, and progress should be made in line with appropriate strategies. SWOT analysis is the most prominent strategic evaluation methods in the literature. When the literature is examined, it was seen that SWOT analysis was not performed with MPR integrated DEMATEL and TOPSIS in the field of the use of digital technologies in the health sector. For this reason, in this study, a SWOT analysis of the use of digital technologies in the health sector was made. SWOT factors were evaluated with the MPR DEMATEL method, and alternative strategies were prioritized with MPR TOPSIS. It is one of the results of the study that importance should be given to the strengths it will provide for the effective use of digital technologies. In addition, in order to benefit from technology in the most effective way, it will be important to create a development roadmap first. In the future, this study can be expanded by taking the opinions of more experts, and a more detailed study can be made by increasing the SWOT factors. Acknowledgements This study has been supported by the Scientific Research Projects Commission of Galatasaray University under grant number FOA-2021-1059.","relations combined swot analysis gülçin büyüközkan and öykü ilıcak department of industrial engineering, faculty of technology and engineering, galatasaray university, istanbul, turkey 34349 gulcin.buyukozkan@gmail.com, oykuilicak12@gmail.com",
58,Evaluation Of Digital Transformation Success Factors In Air  Cargo Industry Using Ifcm Approach,"in the last few years, the world has witnessed major events. while the world was struggling with the effects of covid- 19, on the other hand, people and companies tried to adapt to digital transformation (dt) with the acceleration in technological developments and the needs brought by covid-19. the pandemic process has accelerated the world's adaptation to this transformation. the pandemic process has increased the growth rate of e-commerce, which is already growing rapidly, and increased its influence in the air cargo market. moreover, market growth is not the only challenge facing the air cargo industry. just as it affects every industrial area, dt has started to show its effects in this area as well. at this point, the competition has become fiercer than ever before. air cargo companies need to adapt to dt to compete in the growing market, maintain or increase their market share, generate profits, and enable their sustainability. therefore, air cargo companies must consider critical success factors to successfully implement the transformation. for this purpose, some critical success factors are collected through a literature review process and expert opinions. a case study is conducted using an intuitionistic fuzzy cognitive map (ifcm) approach to analyze these factors in the turkish air cargo industry. furthermore, an ifcm model of these factors is presented. the study results show that the most critical success factors are supply chain visibility, digital twin, and piece centricity among these interrelated factors.",air cargo industry,"and Perspective DT is an undeniable reality of today. The impact of technology on both human life and the business world will be even greater. This situation has begun to affect all sectors from end to end. One of these sectors is the air cargo industry, which keeps the supply chain in the world alive and makes great contributions to the economy of both countries and the world. The air cargo industry, which has grown in line with the demands and needs, has turned into an ecosystem where competition is intense with the DT. Therefore, it's more important than ever to focus on the successful sustainability of the transformation. In this study, some of the critical factors that need to be considered for the successful implementation of DT are investigated and analyzed by the IFCM approach on a real case in the Turkish air cargo industry. The obtained results are in line with the points emphasized by the companies in their research reports. Scenario and sensitivity analyses can be performed in future studies. The scope and the number of the evaluation criteria can be expanded. The results can be compared by making calculations based on different extensions. Results from analytical techniques based on the assumption of independence of criteria can be examined. Acknowledgements The authors would like to give sincere gratitude to industrial experts. This work has been financially supported by Özyeğin University.","gülçin büyüközkan and orhan feyzioğlu professor doctor, professor doctor industrial engineering department, galatasaray university 34349, istanbul, turkey gbuyukozkan@gsu.edu.tr, ofeyzioglu@gsu.edu.tr celal alpay havle assistant professor doctor professional flight program, özyeğin university 34794, istanbul, turkey celal.alpay.havle@gmail.com",
